<?xml version="1.0" encoding="UTF-8"?>
<LauncherEmulator
    xmlns:xsi="http://www.w3.org/2001/XMLSchema-instance"
    xsi:noNamespaceSchemaLocation="../../../xsd/LauncherEmulator.xsd">

<!-- 
    Note that in these examples the prototypes both contain a rompath switch
    I personally store the bios for each machine / machine grouping in its own folder
    In the configuration I then defined the rompath for each machine
 -->

<!-- 
    Instead of looking up the executable path from Launchbox you can define where the executable is directly
    You'll need to change the path to wherever you want to launch the emulator from
-->
    <Prototype key="BespokeMame">
        <EmulatorDefinition>
            <BespokeEmulator>
                <EmulatorPath>V:\Emulators\Arcade\mame0235b\mame.exe</EmulatorPath>
            </BespokeEmulator>
            <CommandLine>
                <ParameterList>
                    <Parameter>
                        <Variable>system</Variable>
                    </Parameter>
                    <Parameter Switch="-keyboardprovider">
                        <Constant>dinput</Constant>
                    </Parameter>
                    <Parameter Switch="-skip_gameinfo"/>
                    <Parameter Switch="-nowindow"/>
                    <Parameter Switch="-rompath">
                        <Variable>biospath</Variable>
                    </Parameter>
                </ParameterList>
            </CommandLine>
        </EmulatorDefinition>
    </Prototype>

<!-- 
    The executable will be looked up in the Launchbox XML files, so if you change the directory for MAME there then the directory mame runs from
    here will change, both methods have their own benefits.
-->
    <Prototype key="Mame">
        <EmulatorDefinition>
            <LaunchboxEmulator>
                <Title>MAME</Title>
            </LaunchboxEmulator>
            <CommandLine>
                <ParameterList>
                    <Parameter>
                        <Variable>system</Variable>
                    </Parameter>
                    <Parameter Switch="-keyboardprovider">
                        <Constant>dinput</Constant>
                    </Parameter>
                    <Parameter Switch="-skip_gameinfo"/>
                    <Parameter Switch="-nowindow"/>
                    <Parameter Switch="-video">
                        <Constant>bgfx</Constant>
                    </Parameter>
                    <Parameter Switch="-bgfx_screen_chains">
                        <Constant>crt-geom</Constant>
                    </Parameter>
                    <Parameter Switch="-rompath">
                        <Variable>biospath</Variable>
                    </Parameter>
                </ParameterList>
            </CommandLine>
        </EmulatorDefinition>
    </Prototype>

    <Emulator key="MameFloppyAutoboot" prototype="Mame">
        <EmulatorDefinition>
            <CommandLine>
                <ParameterList>
                    <Parameter Switch="-flop1">
                        <Default>rompath</Default>
                    </Parameter>
                    <Parameter Switch="-autoboot_command">
                        <Default>autoboot</Default>
                    </Parameter>
                    <Parameter Switch="-autoboot_delay">
                        <Constant>2</Constant>
                    </Parameter>
                </ParameterList>
            </CommandLine>
        </EmulatorDefinition>
    </Emulator>

    <Emulator key="MameAcornDFSAutoboot" prototype="BespokeMame">
        <EmulatorDefinition>
            <CommandLine>
                <ParameterList>
                    <Parameter Switch="-exp">
                        <Variable>exp1</Variable>
                    </Parameter>
                    <Parameter Switch="-cart1">
                        <Variable>cart1</Variable>
                    </Parameter>
                    <Parameter Switch="-flop">
                        <Default>rompath</Default>
                    </Parameter>
                    <Parameter Switch="-autoboot_command">
                        <Default>autoboot</Default>
                    </Parameter>
                    <Parameter Switch="-autoboot_delay">
                        <Constant>2</Constant>
                    </Parameter>
                </ParameterList>
            </CommandLine>
        </EmulatorDefinition>
    </Emulator>

    <Emulator key="MameAcornTapeAutoboot" prototype="BespokeMame">
        <EmulatorDefinition>
            <CommandLine>
                <ParameterList>
                    <Parameter Switch="-cass">
                        <Default>rompath</Default>
                    </Parameter>
                    <Parameter Switch="-exp">
                        <Variable>exp1</Variable>
                    </Parameter>
                    <Parameter Switch="-autoboot_command">
                        <Default>autoboot</Default>
                    </Parameter>
                    <Parameter Switch="-autoboot_delay">
                        <Constant>2</Constant>
                    </Parameter>
                </ParameterList>
            </CommandLine>
        </EmulatorDefinition>
    </Emulator>

    <Emulator key="MameTapeAutoboot" prototype="Mame">
        <EmulatorDefinition>
            <CommandLine>
                <ParameterList>
                    <Parameter Switch="-cass">
                        <Default>rompath</Default>
                    </Parameter>
                    <Parameter Switch="-autoboot_command">
                        <Default>autoboot</Default>
                    </Parameter>
                    <Parameter Switch="-autoboot_delay">
                        <Variable>autobootDelay</Variable>
                    </Parameter>
                </ParameterList>
            </CommandLine>
        </EmulatorDefinition>
    </Emulator>

    <Emulator key="MameLuaDiskAutoboot" prototype="Mame">
        <EmulatorDefinition>
            <CommandLine>
                <ParameterList>
                    <Parameter Switch="-flop1">
                        <Default>rompath</Default>
                    </Parameter>
                    <Parameter Switch="-autoboot_script">
                        <Variable>luaScriptPath</Variable>
                    </Parameter>
                    <Parameter Switch="-autoboot_delay">
                        <Variable>autobootDelay</Variable>
                    </Parameter>
                </ParameterList>
            </CommandLine>
        </EmulatorDefinition>
    </Emulator>

</LauncherEmulator>
